{
  "schema_version": "obs.recorder_budget_status.v1",
  "budget_id": "default-memory-ring-budget",
  "incident_count_scope": "artifact_root",
  "admission_decision": "accept",
  "admission_refusal_reason": null,
  "max_frozen_incidents": 4,
  "existing_frozen_incidents": 1,
  "frozen_incidents_this_run": 1,
  "remaining_frozen_incidents": 3,
  "current_run_included_in_existing": true,
  "max_disk_bytes": 4194304,
  "retained_artifact_bytes_estimate": 8192,
  "retained_artifact_bytes_estimate_scope": "full_inventory",
  "inventory_truncated": false,
  "malformed_entry_count": 0,
  "unreadable_entry_count": 0,
  "data_quality": {
    "dropped": false,
    "drop_count": 0,
    "throttled": false,
    "missing": [],
    "truncated": false,
    "clock_confidence": "medium",
    "notes": [
      "existing_frozen_incidents includes current-run materialized incidents; frozen_incidents_this_run is informational"
    ]
  }
}
